{
  "schema_version": "0.1.0",
  "environment": "test",
  "fixture_only": true,
  "action_id": "agent-action.fixture-resume-001",
  "run_id": "agent-run.fixture-001-resume",
  "session_id": "planning-session.fixture-001",
  "base_session_revision": 4,
  "model_turn_index": 2,
  "proposed_at": "2026-08-03T19:42:30+08:00",
  "proposal_only": true,
  "action_type": "ask_clarifying_question",
  "payload": {
    "question_ref": "question.fixture-destination-resume-001",
    "question_kind": "location",
    "user_safe_question": "请继续选择这次骑行的目的地区域。",
    "answer_mode": "map_pin",
    "blocking_unknown_refs": [
      "unknown.fixture-location-destination-001"
    ]
  },
  "map_actions": [],
  "metadata": {
    "x-fixture": true,
    "x-synthetic": true
  }
}
