{
  "schema_version": "0.1.0",
  "environment": "test",
  "fixture_only": true,
  "action_id": "agent-action.fixture-present-candidates-001",
  "run_id": "agent-run.fixture-002",
  "session_id": "planning-session.fixture-002",
  "base_session_revision": 1,
  "model_turn_index": 2,
  "proposed_at": "2026-08-03T20:10:00+08:00",
  "proposal_only": true,
  "action_type": "present_valid_candidates",
  "payload": {
    "candidates": [
      {
        "candidate_ref": "candidate.fixture-a",
        "plan_revision_ref": {
          "object_ref": {
            "object_id": "ride-plan.fixture-a",
            "object_type": "ride_plan"
          },
          "revision": 1
        },
        "validation_result_ref": "validation.fixture-a-r1"
      },
      {
        "candidate_ref": "candidate.fixture-b",
        "plan_revision_ref": {
          "object_ref": {
            "object_id": "ride-plan.fixture-b",
            "object_type": "ride_plan"
          },
          "revision": 1
        },
        "validation_result_ref": "validation.fixture-b-r1"
      }
    ],
    "user_safe_summary": "两个候选都已通过确定性校验，可以比较，但还没有替你选定。",
    "comparison_summary_ref": "comparison.fixture-candidates-002"
  },
  "map_actions": [
    {
      "schema_version": "0.1.0",
      "environment": "test",
      "fixture_only": true,
      "map_action_id": "map-action.fixture-show-candidates-001",
      "session_id": "planning-session.fixture-002",
      "base_session_revision": 1,
      "source_agent_action_ref": "agent-action.fixture-present-candidates-001",
      "sequence": 1,
      "issued_at": "2026-08-03T20:10:00+08:00",
      "reducer_required": true,
      "action_type": "show_candidate_set",
      "payload": {
        "candidates": [
          {
            "candidate_ref": "candidate.fixture-a",
            "plan_revision_ref": {
              "object_ref": {
                "object_id": "ride-plan.fixture-a",
                "object_type": "ride_plan"
              },
              "revision": 1
            },
            "validation_result_ref": "validation.fixture-a-r1",
            "display_order": 1
          },
          {
            "candidate_ref": "candidate.fixture-b",
            "plan_revision_ref": {
              "object_ref": {
                "object_id": "ride-plan.fixture-b",
                "object_type": "ride_plan"
              },
              "revision": 1
            },
            "validation_result_ref": "validation.fixture-b-r1",
            "display_order": 2
          }
        ]
      },
      "metadata": {
        "x-fixture": true,
        "x-synthetic": true
      }
    }
  ],
  "metadata": {
    "x-fixture": true,
    "x-synthetic": true
  }
}
